{"$schema":"https://json-schema.org/draft/2020-12/schema","title":"Independent audit report","type":"object","additionalProperties":false,"required":["schema_version","id","packet_id","auditor_id","candidate_snapshot_sha256","evidence_integrity","drift_detected","findings","verdict","created_at"],"properties":{"schema_version":{"const":1},"id":{"type":"string"},"packet_id":{"type":"string"},"auditor_id":{"type":"string"},"candidate_snapshot_sha256":{"type":"string","pattern":"^[a-f0-9]{64}$"},"evidence_integrity":{"enum":["VALID","INVALID","INCOMPLETE"]},"drift_detected":{"type":"boolean"},"findings":{"type":"array","items":{"type":"object","additionalProperties":false,"required":["id","severity","summary","evidence"],"properties":{"id":{"type":"string"},"severity":{"enum":["LOW","MODERATE","HIGH","CRITICAL"]},"summary":{"type":"string"},"evidence":{"type":"array","items":{"type":"string"}}}}},"verdict":{"enum":["PASS","PASS_WITH_FINDINGS","FAIL"]},"created_at":{"type":"string","format":"date-time"}}}
